[
{"graph_hash":"sha256:79cdb91a90d871664603972fae7d5cc8c96684acea21551c28f0f735fa032e87","id":"01a0c450-7312-7818-a34b-99d06372417a","label":"pilot-baseline","org_id":"01a0c450-6c01-76c4-8c39-8171fd4953d6","revision":1,"status":"published"},
{"graph_hash":"sha256:eb6c1341c9a14be350f6d5515c0645ba982856109a89980b570dffedee9cb7ab","id":"01a0c450-735c-740b-97de-92538eef8594","label":"after-revert","org_id":"01a0c450-6c01-76c4-8c39-8171fd4953d6","revision":5,"status":"published"},
{"graph_hash":"sha256:a0fba501e1dce6ff5901fbb7141de94348372621314d8b0a9f757d4989c45494","id":"01a0c450-7369-7707-b141-9d6a24727b94","label":"head","org_id":"01a0c450-6c01-76c4-8c39-8171fd4953d6","revision":8,"status":"published"},
{"graph_hash":"sha256:d7e706de965e91819be8990ae55120b4fa2c2bb47f9cbace4a71056adc15f91b","id":"01a0c451-2f82-70a9-9d1e-ab8bca81314d","label":"baseline","org_id":"01a0c451-2f51-7a36-a945-b5532f313ef4","revision":1,"status":"published"}
]
